{
  "artifact_id": "sm_copenhaver_trial_2022_001",
  "artifact_type": "source_metadata",
  "schema_version": "1.0.0",
  "source_id": "copenhaver_pico_on_trial_2022",
  "generated_at": "2026-06-14T19:00:00Z",
  "generating_agent": "human",
  "source_type": "book",
  "source_title": "Pico della Mirandola on Trial: Heresy, Freedom, and Philosophy",
  "authors": ["Brian P. Copenhaver"],
  "publication_date": "2022",
  "publisher": "Oxford University Press",
  "place_of_publication": "Oxford",
  "isbn_or_doi": "9780192855428",
  "local_path": "E:/pdf/renaissance magic/pico/Markdown/Brian_P_Copenhaver_Pico_della_Mirandola_on_Trial__Heresy_Freedom_and_Philosophy_libgen_li_pdf_753eb1fa.md",
  "ingestion_date": "2026-06-13",
  "language": "en",
  "rights_status": "in-copyright",
  "access_notes": "Full text available as Markdown conversion from PDF; OCR quality fair",
  "raw_text_available": true,
  "transcript_available": false,
  "total_pages": 261,
  "db_document_id": null,
  "notes": "Companion volume to Magic and the Dignity of Man (2019). Analyzes Pico's Apology and the 13 condemned theses from the 900 Conclusions. Five chapters on Q1 (Hell), Q4 (Incarnation), Q6/Q9/Q10 (Eucharist), Q8 (will and heresy)."
}
